{
  "components": [
    {
      "key": "amount",
      "label": "Amount",
      "type": "number",
      "validate": {
        "min": 0,
        "max": 1000
      }
    },
    {
      "label": "Text Field",
      "type": "textfield",
      "id": "Field",
      "key": "text",
      "condition": "=amount > 2"
    }
  ],
  "type": "default",
  "id": "Form",
  "schemaVersion": 5
}